{
  "schemaVersion": 1,
  "capabilityId": "sales-training",
  "enterpriseId": "replace-with-enterprise-id",
  "taskId": "replace-with-task-id",
  "version": 1,
  "dealStrategyRef": {
    "taskId": "replace-with-strategy-task-id",
    "version": 1,
    "sha256": "replace-with-sha256"
  },
  "simulationScenario": {
    "customerRole": "待定义",
    "context": "待定义",
    "hiddenInformation": [],
    "successCriteria": [],
    "pauseConditions": [],
    "stopConditions": []
  },
  "coachingPlan": {
    "rounds": 1,
    "feedbackAfterScenario": true,
    "answerForLearner": false
  },
  "scorecard": [],
  "championReplication": {
    "authorized": false,
    "sourceSamples": [],
    "verifiedPatterns": [],
    "excludedAdvantages": [],
    "pilotRequired": true
  },
  "evaluationBoundary": {
    "humanDecisionRequired": true,
    "employmentActionAllowed": false
  },
  "evidenceIndex": [],
  "unknowns": [],
  "clientAutonomy": {
    "pressureTacticsUsed": false,
    "guaranteeMade": false,
    "noSaleAllowed": true
  },
  "externalActions": []
}
